{
  "schemaVersion": "2000m.v2.result.v1",
  "scenarioId": "workflow-resilience-pilot",
  "scenarioVersion": 1,
  "entrant": "calibration-private-path-record",
  "processType": "scripted-agent-loop",
  "ranked": false,
  "compositeScore": 50.0,
  "components": {
    "artifactQuality": {
      "score": 0.0,
      "detail": "private/local v1 conformance JSON"
    },
    "feedbackIntegration": {
      "score": 100.0,
      "detail": "4/4 feedback phases covered"
    },
    "recoveryHandoff": {
      "score": 100.0,
      "detail": "1/1 recovery phases covered"
    },
    "stopCondition": {
      "score": 100.0,
      "detail": "correctly avoids blind continuation for trap types: impossible, probe-only, stale"
    },
    "evidenceReplay": {
      "score": 0.0,
      "detail": "build, score, commit, and evidence replayability checks"
    }
  },
  "warnings": [
    "RANK-BLOCK: artifact v1ConformanceJson `/Users/private/v1-conformance.json` is private or local-only before read",
    "RANK-BLOCK: private or local-only evidence ref is not rankable: `/Users/private/v1-conformance.json`"
  ]
}
